{
  "$schema": "http://json-schema.org/draft-07/schema",
  "$id": "https://schema.swlegion.dev/deps/Unit.json",

  "title": "Unit Card",
  "description": "Definition of a unit card.",

  "definitions": {
    "Bases": {
      "enum": [
        "small",
        "medium",
        "large",
        "huge",
        "laat",
        "epic",
        "long",
        "snail"
      ]
    }
  },

  "properties": {
    "name": {
      "type": "string",
      "minLength": 1
    },

    "title": {
      "type": "string",
      "minLength": 1
    },

    "displayName": {
      "description": "Optional. If provided, is used instead of name or title for list building purposes.",
      "type": "string",
      "minLength": 1
    },

    "image": {
      "$ref": "./Image.json"
    },

    "size": {
      "description": "Size of the base.",
      "$ref": "#/definitions/Bases"
    },

    "type": {
      "anyOf": [
        { "$ref": "./UnitTypes.json" },
        {
          "type": "string",
          "minLength": 1
        }
      ]
    },

    "hover": {
      "description": "Optional. The unit's Hover keyword: \"ground\" means it blocks line of sight and provides cover like a ground vehicle.",
      "enum": ["ground", "air"]
    },

    "silhouette": {
      "type": "object",
      "description": "Optional.  Height and Offset values for a Custom Silhouette.",
      "properties": {
        "height": { "type" : "number" },
        "offset": { "type" : "number" }
      }
    },

    "heavyWeaponTeam": {
      "description": "Reqyure a \"Heavy Weapon\" upgrade attached to this unit and make it the unit leader.",
      "enum": [true]
    },

    "minis": {
      "oneOf": [
        {
          "description": "Number of placeholder minis to spawn",
          "type": "number",
          "minimum": 1
        },
        {
          "type": "array",
          "minItems": 1,
          "items": {
            "$ref": "./Mini.json"
          }
        }
      ]
    },

    "points": {
      "type": "number",
      "minimum": 0
    },

    "speed": {
      "type": "number",
      "minimum": 0
    },

    "height": {
      "description": "The approximate height of the model, in inches. The default, which is intended for small-base (trooper) minis, is 2.",
      "type": "number",
      "minimum": 1,
      "default": 2,
      "maximum": 10
    },

    "upgrades": {
      "additionalProperties": {
        "type": "number",
        "minimum": 1
      },

      "propertyNames": {
        "anyOf": [
          { "$ref": "./Upgrades.json" },
          {
            "type": "string",
            "minLength": 1
          }
        ]
      },

      "type": "object"
    },

    "commands": {
      "type": "array",
      "minItems": 1,
      "items": {
        "$ref": "./CommandCard.json"
      }
    },

    "required": {
      "type": "array",
      "description": "Required upgrades or flaw cards, by name.",
      "minItems": 1,
      "items": {
        "type": "string"
      }
    },

    "additionalObjects": {
      "$ref": "./AdditionalObjects.json"
    }
  },

  "additionalProperties": false,
  "type": "object",
  "required": ["name", "image", "size", "type", "points", "speed", "upgrades"]
}
